{
  "schema_version": "cis-evidence-pack/0.2",
  "generated_at_utc": "2026-09-25T07:56:19Z",
  "receipt": {
    "source_path": "/home/justinbrianthompson/projects/cis2-fp-cm-gpu2/gpu/kaggle_gpu2/receipts/gpu2-int8-grouped.receipt",
    "receipt_sha256": "c188506bf0bbc456bafb1a16a6f10001416e977555f49c4b0064115217412714",
    "fields": {
      "config": "batch1_int8",
      "digest": "413114502d874b105afd65941d2ee80cb14f344305eb1595c7c249d0658f647e",
      "vs_cpu_batch1": "MISMATCH",
      "diffs": "576/576"
    },
    "receipt_timestamp_utc": null
  },
  "canonical_weights_id": {
    "value": "UNAVAILABLE",
    "method": "receipt-embedded-digest-not-independently-recomputed",
    "source": "no weights file provided and no recognizable weights digest field in receipt"
  },
  "verifier": {
    "path": "/home/justinbrianthompson/projects/cis2-fp-cm-gpu2/gpu/cis2_sweep_host",
    "sha256": "9793ed3eb2ed924793f1bf21a3993d452b2f3a152adab1845eba2df04236ce20",
    "version_string": null,
    "invocation": "Rebuilt locally from gpu/cis2_sweep.cpp (g++ -std=c++17 -O2 -DCIS2_BATCH_GROUPED) for provenance pinning of the source that produced this SWEEP line; this local binary's sha256 does NOT match the exact bits executed on Kaggle (Kaggle T4 kernel aefinityaiinc/gpu2-batch-int8 v2, COMPLETE, different toolchain/environment, real GPU+weights). verify-output is an excerpt of the committed Kaggle kernel log, not a fresh local re-run (no local GPU or model weights available on this box). MISMATCH here is the expected, disclosed result of int8 quantization error -- this path is NOT conformant and must never be presented as conformant.",
    "output_source": "provided-log-file"
  },
  "host_fingerprint": {
    "isa": "x86_64",
    "platform": "Linux-6.6.147-09642-gea7f90d2e99e-x86_64-with-glibc2.41",
    "cpu_model": "Intel(R) Core(TM) i5-10210U CPU @ 1.60GHz",
    "cpu_flags": [
      "fpu",
      "vme",
      "de",
      "pse",
      "tsc",
      "msr",
      "pae",
      "mce",
      "cx8",
      "apic",
      "sep",
      "mtrr",
      "pge",
      "mca",
      "cmov",
      "pat",
      "pse36",
      "clflush",
      "mmx",
      "fxsr",
      "sse",
      "sse2",
      "ss",
      "ht",
      "syscall",
      "nx",
      "pdpe1gb",
      "rdtscp",
      "lm",
      "constant_tsc",
      "arch_perfmon",
      "rep_good",
      "nopl",
      "xtopology",
      "nonstop_tsc",
      "cpuid",
      "tsc_known_freq",
      "pni",
      "pclmulqdq",
      "ssse3",
      "fma",
      "cx16",
      "pdcm",
      "pcid",
      "sse4_1",
      "sse4_2",
      "x2apic",
      "movbe",
      "popcnt",
      "tsc_deadline_timer",
      "aes",
      "xsave",
      "avx",
      "f16c",
      "rdrand",
      "hypervisor",
      "lahf_lm",
      "abm",
      "3dnowprefetch",
      "cpuid_fault",
      "ssbd",
      "ibrs",
      "ibpb",
      "stibp",
      "ibrs_enhanced",
      "fsgsbase",
      "tsc_adjust",
      "bmi1",
      "avx2",
      "smep",
      "bmi2",
      "erms",
      "invpcid",
      "mpx",
      "rdseed",
      "adx",
      "smap",
      "clflushopt",
      "xsaveopt",
      "xsavec",
      "xgetbv1",
      "xsaves",
      "arat",
      "umip",
      "md_clear",
      "arch_capabilities"
    ],
    "pinned_env": {
      "RUSTFLAGS": null,
      "taskset_available": true,
      "nproc": 8,
      "in_container_cgroup_hint": false
    }
  },
  "verdict": "MISMATCH",
  "verdict_raw_excerpt": "TCH_GROUPED), vs CPU batch1 baseline.\n# MISMATCH is the expected, disclosed result of in",
  "scope_disclaimer": "This evidence pack documents ONE CIS-2 verifiable-inference receipt: that a specific, pinned set of model weights, config, and tokenizer, run through a specific reference verifier, reproduces a specific witness/decode digest bit-for-bit. It is Processing Integrity evidence for the inference computation step only. It contains no timing/latency numbers, no access-control, availability, or confidentiality evidence. An auditor should independently re-run the referenced verifier against the referenced inputs and confirm the digest match themselves; this pack is a transport format for what to feed the verifier, not a substitute for that re-verification.",
  "acknowledgments": "## Acknowledgments\n\nA special thank you to Charles Seaman and Linda Blanchard, whose contributions have helped Aefinity AI stay on track.\n\nAnd a very special thank you to **Bonnie Rae Power**: an amazing woman, a great friend and neighbor, without whom Aefinity AI would have never had a chance to ever get started. Thank you, Bonnie, for your advice, care, encouragement, guidance, intuitive wisdom, and financial assistance.\n",
  "render": {
    "format": "pdf-chromium",
    "fallback_disclosed": false
  }
}
